{
  "projectRepoUrl": "https://github.com/17-jd/Hire_3",
  "title": "Hire & Fire",
  "description": "A service marketplace where people can find and hire any service provider — like Uber, but for all services. Built with Next.js, TypeScript, Prisma, Supabase, and Tailwind CSS.",
  "loomVideoUrl": "https://www.loom.com/share/9f5de0789307414793e87b8a7d37f5ae"
}
