{
  "projectRepoUrl": "https://github.com/johnobrien/ContestBot",
  "deployedUrl": "https://your-app.example.com",
  "title": "A Bot that finds and applies to contests you don't need a purchase to win",
  "description": "A Bot that finds and applies to contests you don't need a purchase to win",
  "loomVideoUrl": "https://www.loom.com/share/3debbe4225dd47ab829c69f9eba1b31a"
}