{
  "projectRepoUrl": "https://github.com/mekhalraj/milo",
  "title": "Milo",
  "description": "An AI-powered LinkedIn outreach and reply management tool. Milo ranks leads, drafts personalized messages, classifies replies, and generates responses — automating the full LinkedIn engagement workflow.",
  "loomVideoUrl": "https://www.loom.com/share/REPLACE_WITH_YOUR_LOOM_ID"
}
